{
        "langValue" : "en",
        "table" : "Table '",
        "scan" : "Scan count ",
        "logical" : "logical reads ",
        "physical" : "physical reads ",
        "readahead" : "read-ahead reads ",
        "loblogical" : "lob logical reads ",
        "lobphysical" : "lob physical reads ",
        "lobreadahead" : "lob read-ahead reads ",
        "headerrownum" : "Row Num",
        "headertable" : "Table",
        "headerscan" : "Scan Count",
        "headerlogical" : "Logical Reads",
        "headerphysical" : "Physical Reads",
        "headerreadahead" : "Read-Ahead Reads",
        "headerloblogical" : "LOB Logical Reads",
        "headerlobphysical" : "LOB Physical Reads",
        "headerlobreadahead" : "LOB Read-Ahead Reads",
        "headerperlogicalread" : "% Logical Reads of Total Reads",
        "executiontime" : "SQL Server Execution Times:",
        "compiletime" : "SQL Server parse and compile time:",
        "cputime" : "CPU time = ",
        "elapsedtime" : "elapsed time = ",
        "elapsedlabel" : "Elapsed",
        "cpulabel" : "CPU",
        "milliseconds" : "ms",
        "rowsaffected" : "row(s) affected",
        "headerrowsaffected" : " rows affected",
        "headerrowaffected" : " row affected",
        "sampleoutput" :  "\r\n SQL Server Execution Times:\r\n   CPU time = 0 ms,  elapsed time = 0 ms.\r\nSQL Server parse and compile time: \r\n   CPU time = 156 ms, elapsed time = 159 ms.\r\n\r\n(13431682 row(s) affected)\r\nTable \u0027PostTypes\u0027. Scan count 1, logical reads 2, physical reads 0, read-ahead reads 0, lob logical reads 0, lob physical reads 0, lob read-ahead reads 0.\r\nTable \u0027Users\u0027. Scan count 5, logical reads 41951, physical reads 0, read-ahead reads 41364, lob logical reads 0, lob physical reads 0, lob read-ahead reads 0.\r\nTable \u0027Comments\u0027. Scan count 5, logical reads 1089552, physical reads 115, read-ahead reads 1088451, lob logical reads 0, lob physical reads 0, lob read-ahead reads 0.\r\nTable \u0027PostTags\u0027. Scan count 5, logical reads 78130, physical reads 24, read-ahead reads 76742, lob logical reads 0, lob physical reads 0, lob read-ahead reads 0.\r\nTable \u0027Posts\u0027. Scan count 5, logical reads 397424, physical reads 808, read-ahead reads 393173, lob logical reads 0, lob physical reads 0, lob read-ahead reads 0.\r\nTable \u0027Worktable\u0027. Scan count 999172, logical reads 16247024, physical reads 0, read-ahead reads 0, lob logical reads 0, lob physical reads 0, lob read-ahead reads 0.\r\nTable \u0027Worktable\u0027. Scan count 0, logical reads 0, physical reads 0, read-ahead reads 0, lob logical reads 0, lob physical reads 0, lob read-ahead reads 0.\r\n\r\n(1 row(s) affected)\r\n\r\n SQL Server Execution Times:\r\n   CPU time = 218958 ms,  elapsed time = 340331 ms.\r\n\r\n(233033 row(s) affected)\r\nTable \u0027Worktable\u0027. Scan count 0, logical reads 0, physical reads 0, read-ahead reads 0, lob logical reads 0, lob physical reads 0, lob read-ahead reads 0.\r\nTable \u0027Votes\u0027. Scan count 1, logical reads 250128, physical reads 4, read-ahead reads 250123, lob logical reads 0, lob physical reads 0, lob read-ahead reads 0.\r\nTable \u0027Posts\u0027. Scan count 1, logical reads 162040, physical reads 11, read-ahead reads 53676, lob logical reads 823161, lob physical reads 42463, lob read-ahead reads 3272.\r\nTable \u0027Users\u0027. Scan count 1, logical reads 41405, physical reads 3, read-ahead reads 41385, lob logical reads 0, lob physical reads 0, lob read-ahead reads 0.\r\n\r\n(1 row(s) affected)\r\n\r\n SQL Server Execution Times:\r\n   CPU time = 24819 ms,  elapsed time = 46202 ms.\r\nSQL Server parse and compile time: \r\n   CPU time = 0 ms, elapsed time = 0 ms.\r\n\r\n SQL Server Execution Times:\r\n   CPU time = 0 ms,  elapsed time = 0 ms.\r\n"
}